{
 "schema": 1,
 "preset": "C919",
 "body": "fuselage",
 "reference_length_m": 38.9,
 "degree": 5,
 "frame": "x aft of nose tip, y right, z up, metres; z datum identical to the preset fuselage frame (cabin_z_m etc.)",
 "curves": {
  "A": {
   "knots": [
    0.0,
    0.0,
    0.0,
    0.0,
    0.0,
    0.0,
    0.02570694087403599,
    0.0599828620394173,
    0.08631105398457584,
    0.09425878320479864,
    0.10154241645244216,
    0.10154241645244216,
    0.10154241645244216,
    0.718508997429306,
    0.718508997429306,
    0.718508997429306,
    0.7686375321336761,
    0.8107969151670952,
    0.8529562982005142,
    0.8733290488431877,
    0.8951156812339331,
    0.9372750642673522,
    0.9794344473007712,
    1.0,
    1.0,
    1.0,
    1.0,
    1.0,
    1.0
   ],
   "coeffs": [
    -2.255171435938981e-15,
    0.07999999999998891,
    0.8575090817739977,
    1.3073436091084087,
    2.4502063638465787,
    2.9633240442888518,
    3.820101399497966,
    3.9204000000000003,
    3.920400000000006,
    3.920400000000008,
    3.92040000000001,
    3.920399999999998,
    3.920400000000003,
    3.2811166962798186,
    3.00401707619853,
    1.9540281649495648,
    1.2618048184481738,
    0.7314080239873235,
    0.8085736606058298,
    0.39523086995242396,
    0.1608847332091587,
    0.05947415435260037,
    0.03487909104278982
   ]
  },
  "E": {
   "knots": [
    0.0,
    0.0,
    0.0,
    0.0,
    0.0,
    0.0,
    0.015424164524421594,
    0.04318766066838047,
    0.07095115681233934,
    0.09871465295629821,
    0.11253213367609256,
    0.12647814910025706,
    0.13239074550128535,
    0.13239074550128535,
    0.13239074550128535,
    0.6529562982005142,
    0.6529562982005142,
    0.6529562982005142,
    0.7686375321336761,
    0.8046272493573264,
    0.8406169665809767,
    0.8438303341902313,
    0.8766066838046271,
    0.9125964010282777,
    0.9485861182519281,
    0.9652956298200515,
    0.9845758354755784,
    1.0,
    1.0,
    1.0,
    1.0,
    1.0,
    1.0
   ],
   "coeffs": [
    -5.127125056553396e-15,
    0.04799999999999727,
    0.404969893051085,
    0.8519103290085811,
    1.9433780711107813,
    3.192319477025238,
    3.653550362778671,
    4.00831905431041,
    4.276884745682838,
    4.338888999999988,
    4.338889000000024,
    4.338889000000007,
    4.338889000000004,
    4.338889000000011,
    4.338889000000006,
    3.315016969402708,
    3.218495536220822,
    2.3013411029657553,
    1.8157374161179378,
    1.3859043647209202,
    1.015390290304236,
    0.6163955105478826,
    0.3069850893004255,
    0.15506836375950467,
    0.0858629746059458,
    0.0502793128582665,
    0.037037277611870416
   ]
  },
  "zc": {
   "knots": [
    0.0,
    0.0,
    0.0,
    0.0,
    0.0,
    0.0,
    0.015424164524421594,
    0.04318766066838047,
    0.07095115681233934,
    0.09871465295629821,
    0.11253213367609256,
    0.12647814910025706,
    0.13239074550128535,
    0.13239074550128535,
    0.13239074550128535,
    0.6529562982005142,
    0.6529562982005142,
    0.6529562982005142,
    0.7686375321336761,
    0.8046272493573264,
    0.8406169665809767,
    0.8438303341902313,
    0.8766066838046271,
    0.9125964010282777,
    0.9485861182519281,
    0.9652956298200515,
    0.9845758354755784,
    1.0,
    1.0,
    1.0,
    1.0,
    1.0,
    1.0
   ],
   "coeffs": [
    -0.7547608789314946,
    -0.7344476035719042,
    -0.6645957485636697,
    -0.5764249008820781,
    -0.25059880547359964,
    -0.0471473136537221,
    -0.003539123103142538,
    0.0505779254092157,
    0.08964904159838788,
    0.09999999999999744,
    0.09999999999999729,
    0.09999999999999645,
    0.09999999999999774,
    0.09999999999999652,
    0.09999999999999709,
    0.285339233828403,
    0.37338772601310477,
    0.5425237013968746,
    0.6386206710811083,
    0.7473582817997878,
    0.8546731402260941,
    0.9686212195492309,
    1.04122486129369,
    1.1081656058429477,
    1.1317164730538178,
    1.1405659817925338,
    1.1430848442401946
   ]
  },
  "n": {
   "knots": [
    0.0,
    0.0,
    0.0,
    0.0,
    0.0,
    0.0,
    1.0,
    1.0,
    1.0,
    1.0,
    1.0,
    1.0
   ],
   "coeffs": [
    2.0,
    2.0,
    2.0,
    2.0,
    2.0,
    2.0
   ]
  },
  "k": {
   "knots": [
    0.0,
    0.0,
    0.0,
    0.0,
    0.0,
    0.0,
    1.0,
    1.0,
    1.0,
    1.0,
    1.0,
    1.0
   ],
   "coeffs": [
    0.0,
    0.0,
    0.0,
    0.0,
    0.0,
    0.0
   ]
  }
 },
 "front": {
  "kind": "point",
  "tip_radius_m": 0.2
 },
 "rear": {
  "kind": "base"
 },
 "cabin": {
  "x_start_m": 3.5,
  "x_end_m": 31.13
 },
 "fairness": {
  "inflections": {
   "crown": 1,
   "keel": 2,
   "plan": 2
  },
  "tv_ratio_max": 1.5
 },
 "fit": {
  "rms_m": 0.010886471633247808,
  "max_m": 0.07818667747535421,
  "lambda": 1.0,
  "tool_version": "loft_fit 0.1 + fairfit 1 (quality pass 2026-10-11)"
 },
 "provenance": [
  {
   "group": "A",
   "kind": "measured",
   "drawing": {
    "id": "comac_c919_acap",
    "title": "COMAC C919 ACAP C919-SVV19-50009-00 Issue 003 (2025-10-17)",
    "page": "02-02 Fig 1",
    "sha256": "",
    "path": "(see refs/_verify* of the 2026-10-07 matrix)"
   },
   "view": "top",
   "px_per_m": 59.598813746750736,
   "n_samples": 860,
   "rms_m": 0.01297607023732141,
   "max_m": 0.07818667747535421,
   "confidence": "A",
   "note": "plan half-width from the calibrated top silhouette (both halves averaged, centreline offset 0.008 m removed); wing/hstab/fairing intervals excluded (exclusions/C919.json); plateau value = preset D/2, line-width correction +0.075 m/side | quality pass 2026-10-11: refit under the Rust sampled fairness metric (inflections where radius < 50 local half-sizes) with the accuracy gates kept"
  },
  {
   "group": "E",
   "kind": "measured",
   "drawing": {
    "id": "comac_c919_acap",
    "title": "COMAC C919 ACAP C919-SVV19-50009-00 Issue 003 (2025-10-17)",
    "page": "02-02 Fig 1",
    "sha256": "",
    "path": "(see refs/_verify* of the 2026-10-07 matrix)"
   },
   "view": "side",
   "px_per_m": 59.66580976863754,
   "n_samples": 1719,
   "rms_m": 0.009673942075006322,
   "max_m": 0.06613004244263163,
   "confidence": "A",
   "note": "half-height from crown and keel of the side silhouette; fin/engine/gear/fairing intervals excluded; plateau = preset height_m/2 (H measured 4.324 m) | quality pass 2026-10-11: refit under the Rust sampled fairness metric (inflections where radius < 50 local half-sizes) with the accuracy gates kept"
  },
  {
   "group": "zc",
   "kind": "measured",
   "drawing": {
    "id": "comac_c919_acap",
    "title": "COMAC C919 ACAP C919-SVV19-50009-00 Issue 003 (2025-10-17)",
    "page": "02-02 Fig 1",
    "sha256": "",
    "path": "(see refs/_verify* of the 2026-10-07 matrix)"
   },
   "view": "side",
   "px_per_m": 59.66580976863754,
   "n_samples": 1719,
   "rms_m": 0.009673942075006322,
   "max_m": 0.06613004244263163,
   "confidence": "A",
   "note": "centreline height; z datum: crown of the drawing = cabin_z + H/2 of the preset; nose tip z from the drawing -0.755 m (preset nose_z_m -0.68) | quality pass 2026-10-11: refit under the Rust sampled fairness metric (inflections where radius < 50 local half-sizes) with the accuracy gates kept"
  },
  {
   "group": "n",
   "kind": "template",
   "drawing": {
    "id": "comac_c919_acap",
    "title": "COMAC C919 ACAP C919-SVV19-50009-00 Issue 003 (2025-10-17)",
    "page": "02-02 Fig 1",
    "sha256": "",
    "path": "(see refs/_verify* of the 2026-10-07 matrix)"
   },
   "view": "front",
   "px_per_m": 59.66580976863754,
   "n_samples": 0,
   "rms_m": 0.0,
   "max_m": 0.0,
   "confidence": "A",
   "note": "n = 2 (ellipse): no dimensioned cabin cross-section is available in the masks; unmeasured"
  },
  {
   "group": "k",
   "kind": "template",
   "drawing": {
    "id": "comac_c919_acap",
    "title": "COMAC C919 ACAP C919-SVV19-50009-00 Issue 003 (2025-10-17)",
    "page": "02-02 Fig 1",
    "sha256": "",
    "path": "(see refs/_verify* of the 2026-10-07 matrix)"
   },
   "view": "side",
   "px_per_m": 59.66580976863754,
   "n_samples": 0,
   "rms_m": 0.0,
   "max_m": 0.0,
   "confidence": "A",
   "note": "k = 0 (shoulder at centreline): unmeasured"
  },
  {
   "group": "closure",
   "kind": "measured",
   "drawing": {
    "id": "comac_c919_acap",
    "title": "COMAC C919 ACAP C919-SVV19-50009-00 Issue 003 (2025-10-17)",
    "page": "02-02 Fig 1",
    "sha256": "",
    "path": "(see refs/_verify* of the 2026-10-07 matrix)"
   },
   "view": "side",
   "px_per_m": 59.66580976863754,
   "n_samples": 0,
   "rms_m": 0.0,
   "max_m": 0.0,
   "confidence": "A",
   "note": "front: point nose, tip radius 0.20 m (scan 0.10-0.30 m, minimum-knot/minimum-RMS choice, resolution-limited); rear: finite base A=0.031 m2 (a=0.175 m), E=0.045 m2 (e=0.213 m)"
  },
  {
   "group": "cabin",
   "kind": "dimension",
   "drawing": {
    "id": "comac_c919_acap",
    "title": "COMAC C919 ACAP C919-SVV19-50009-00 Issue 003 (2025-10-17)",
    "page": "02-02 Fig 1",
    "sha256": "",
    "path": "(see refs/_verify* of the 2026-10-07 matrix)"
   },
   "view": "side",
   "px_per_m": 59.66580976863754,
   "n_samples": 0,
   "rms_m": 0.0,
   "max_m": 0.0,
   "confidence": "A",
   "note": "cabin_start_x_m / tailcone_length_m of the preset (payload semantics, unchanged); the flat plateau of the loft is fitted from the drawing and is NOT the payload cabin interval"
  }
 ]
}