{
 "schema": 1,
 "preset": "DC-10",
 "body": "fuselage",
 "reference_length_m": 55.35,
 "degree": 5,
 "frame": "x aft of nose tip, y right, z up, metres; z datum identical to the preset fuselage frame (cabin_z_m etc.)",
 "curves": {
  "A": {
   "knots": [
    0.0,
    0.0,
    0.0,
    0.0,
    0.0,
    0.0,
    0.18066847335140018,
    0.18066847335140018,
    0.18066847335140018,
    0.5871725383920505,
    0.5871725383920505,
    0.5871725383920505,
    0.6697380307136405,
    1.0,
    1.0,
    1.0,
    1.0,
    1.0,
    1.0
   ],
   "coeffs": [
    3.584634692866831e-16,
    0.6000000000000003,
    7.258207065891418,
    9.06010000000002,
    9.06010000000002,
    9.060100000000014,
    9.060100000000002,
    9.060100000000002,
    9.060100000000006,
    8.96097635107,
    0.6434466332370898,
    0.1759523587532809,
    0.05770961651312706
   ]
  },
  "E": {
   "knots": [
    0.0,
    0.0,
    0.0,
    0.0,
    0.0,
    0.0,
    0.18066847335140018,
    0.18066847335140018,
    0.18066847335140018,
    0.5420054200542005,
    0.5420054200542005,
    0.5420054200542005,
    0.6901535682023487,
    0.7939024390243903,
    1.0,
    1.0,
    1.0,
    1.0,
    1.0,
    1.0
   ],
   "coeffs": [
    -1.4879586367209798e-15,
    0.6000000000000012,
    9.059373205589248,
    9.060099999999995,
    9.060099999999997,
    9.060099999999995,
    9.060099999999997,
    9.060099999999995,
    9.0601,
    9.901191682710824,
    3.548805190931495,
    1.2351458386428569,
    0.13843060542980162,
    0.015361377060011276
   ]
  },
  "zc": {
   "knots": [
    0.0,
    0.0,
    0.0,
    0.0,
    0.0,
    0.0,
    0.18066847335140018,
    0.18066847335140018,
    0.18066847335140018,
    0.5420054200542005,
    0.5420054200542005,
    0.5420054200542005,
    0.6901535682023487,
    0.7939024390243903,
    1.0,
    1.0,
    1.0,
    1.0,
    1.0,
    1.0
   ],
   "coeffs": [
    -0.1829790530846511,
    -0.04133383300745541,
    0.34429411405809274,
    0.1999999999999953,
    0.200000000000003,
    0.1999999999999985,
    0.20000000000000184,
    0.19999999999999668,
    0.19999999999999482,
    -0.10841105340824987,
    0.6182291923194295,
    0.8412622471668476,
    1.6698424378434735,
    2.3429814579500987
   ]
  },
  "n": {
   "knots": [
    0.0,
    0.0,
    0.0,
    0.0,
    0.0,
    0.0,
    1.0,
    1.0,
    1.0,
    1.0,
    1.0,
    1.0
   ],
   "coeffs": [
    2.0,
    2.0,
    2.0,
    2.0,
    2.0,
    2.0
   ]
  },
  "k": {
   "knots": [
    0.0,
    0.0,
    0.0,
    0.0,
    0.0,
    0.0,
    1.0,
    1.0,
    1.0,
    1.0,
    1.0,
    1.0
   ],
   "coeffs": [
    0.0,
    0.0,
    0.0,
    0.0,
    0.0,
    0.0
   ]
  }
 },
 "front": {
  "kind": "point",
  "tip_radius_m": 0.15
 },
 "rear": {
  "kind": "base"
 },
 "cabin": {
  "x_start_m": 5.5,
  "x_end_m": 43.85
 },
 "fairness": {
  "inflections": {
   "crown": 1,
   "keel": 2,
   "plan": 2
  },
  "tv_ratio_max": 1.5
 },
 "fit": {
  "rms_m": 0.06534766904417708,
  "max_m": 0.2649158915070637,
  "lambda": 0.00017524770681008042,
  "tool_version": "loft_fit 0.1"
 },
 "provenance": [
  {
   "group": "A",
   "kind": "measured",
   "drawing": {
    "id": "boeing_2023_dc10acap",
    "title": "Boeing (McDonnell Douglas) DC-10 ACAP 2023, 2.2 (scan, outline traced manually)",
    "page": "2.2",
    "sha256": "6d9e50da8cea61da66b0aaa58d1454e6d782ddaa48b027a80183c10541180ce3",
    "path": "<fit-workdir>/boeing-dc10.pdf"
   },
   "view": "top",
   "px_per_m": 27.07,
   "n_samples": 1179,
   "rms_m": 0.0715878737698614,
   "max_m": 0.19884174429997875,
   "confidence": "C",
   "note": "plan half-width from the calibrated top silhouette (both halves averaged, centreline offset 0.019 m removed); wing/hstab/fairing intervals excluded (exclusions/DC-10.json); plateau value = preset D/2, line-width correction -0.009 m/side"
  },
  {
   "group": "E",
   "kind": "measured",
   "drawing": {
    "id": "boeing_2023_dc10acap",
    "title": "Boeing (McDonnell Douglas) DC-10 ACAP 2023, 2.2 (scan, outline traced manually)",
    "page": "2.2",
    "sha256": "6d9e50da8cea61da66b0aaa58d1454e6d782ddaa48b027a80183c10541180ce3",
    "path": "<fit-workdir>/boeing-dc10.pdf"
   },
   "view": "side",
   "px_per_m": 27.88,
   "n_samples": 2255,
   "rms_m": 0.06189080135024204,
   "max_m": 0.2649158915070637,
   "confidence": "C",
   "note": "half-height from crown and keel of the side silhouette; fin/engine/gear/fairing intervals excluded; plateau = preset height_m/2 (H measured 6.044 m)"
  },
  {
   "group": "zc",
   "kind": "measured",
   "drawing": {
    "id": "boeing_2023_dc10acap",
    "title": "Boeing (McDonnell Douglas) DC-10 ACAP 2023, 2.2 (scan, outline traced manually)",
    "page": "2.2",
    "sha256": "6d9e50da8cea61da66b0aaa58d1454e6d782ddaa48b027a80183c10541180ce3",
    "path": "<fit-workdir>/boeing-dc10.pdf"
   },
   "view": "side",
   "px_per_m": 27.88,
   "n_samples": 2255,
   "rms_m": 0.06189080135024204,
   "max_m": 0.2649158915070637,
   "confidence": "C",
   "note": "centreline height; z datum: crown of the drawing = cabin_z + H/2 of the preset; nose tip z from the drawing -0.183 m (preset nose_z_m 0.53)"
  },
  {
   "group": "n",
   "kind": "template",
   "drawing": {
    "id": "boeing_2023_dc10acap",
    "title": "Boeing (McDonnell Douglas) DC-10 ACAP 2023, 2.2 (scan, outline traced manually)",
    "page": "2.2",
    "sha256": "6d9e50da8cea61da66b0aaa58d1454e6d782ddaa48b027a80183c10541180ce3",
    "path": "<fit-workdir>/boeing-dc10.pdf"
   },
   "view": "front",
   "px_per_m": 27.88,
   "n_samples": 0,
   "rms_m": 0.0,
   "max_m": 0.0,
   "confidence": "C",
   "note": "n = 2 (ellipse): no dimensioned cabin cross-section is available in the masks; unmeasured"
  },
  {
   "group": "k",
   "kind": "template",
   "drawing": {
    "id": "boeing_2023_dc10acap",
    "title": "Boeing (McDonnell Douglas) DC-10 ACAP 2023, 2.2 (scan, outline traced manually)",
    "page": "2.2",
    "sha256": "6d9e50da8cea61da66b0aaa58d1454e6d782ddaa48b027a80183c10541180ce3",
    "path": "<fit-workdir>/boeing-dc10.pdf"
   },
   "view": "side",
   "px_per_m": 27.88,
   "n_samples": 0,
   "rms_m": 0.0,
   "max_m": 0.0,
   "confidence": "C",
   "note": "k = 0 (shoulder at centreline): unmeasured"
  },
  {
   "group": "closure",
   "kind": "measured",
   "drawing": {
    "id": "boeing_2023_dc10acap",
    "title": "Boeing (McDonnell Douglas) DC-10 ACAP 2023, 2.2 (scan, outline traced manually)",
    "page": "2.2",
    "sha256": "6d9e50da8cea61da66b0aaa58d1454e6d782ddaa48b027a80183c10541180ce3",
    "path": "<fit-workdir>/boeing-dc10.pdf"
   },
   "view": "side",
   "px_per_m": 27.88,
   "n_samples": 0,
   "rms_m": 0.0,
   "max_m": 0.0,
   "confidence": "C",
   "note": "front: point nose, tip radius 0.15 m (scan 0.10-0.30 m, minimum-knot/minimum-RMS choice, resolution-limited); rear: finite base A=0.058 m2 (a=0.240 m), E=0.015 m2 (e=0.124 m)"
  },
  {
   "group": "cabin",
   "kind": "dimension",
   "drawing": {
    "id": "boeing_2023_dc10acap",
    "title": "Boeing (McDonnell Douglas) DC-10 ACAP 2023, 2.2 (scan, outline traced manually)",
    "page": "2.2",
    "sha256": "6d9e50da8cea61da66b0aaa58d1454e6d782ddaa48b027a80183c10541180ce3",
    "path": "<fit-workdir>/boeing-dc10.pdf"
   },
   "view": "side",
   "px_per_m": 27.88,
   "n_samples": 0,
   "rms_m": 0.0,
   "max_m": 0.0,
   "confidence": "C",
   "note": "cabin_start_x_m / tailcone_length_m of the preset (payload semantics, unchanged); the flat plateau of the loft is fitted from the drawing and is NOT the payload cabin interval"
  }
 ]
}