{
 "schema": 1,
 "preset": "ATR72-600",
 "body": "fuselage",
 "reference_length_m": 27.166,
 "degree": 5,
 "frame": "x aft of nose tip, y right, z up, metres; z datum identical to the preset fuselage frame (cabin_z_m etc.)",
 "curves": {
  "A": {
   "knots": [
    0.0,
    0.0,
    0.0,
    0.0,
    0.0,
    0.0,
    0.16564823676654641,
    0.16564823676654641,
    0.16564823676654641,
    0.6257822277847309,
    0.6257822277847309,
    0.6257822277847309,
    1.0,
    1.0,
    1.0,
    1.0,
    1.0,
    1.0
   ],
   "coeffs": [
    -1.3801234093024302e-15,
    0.539999999999998,
    2.250696680044093,
    2.0520562499999966,
    2.0520562500000157,
    2.052056250000012,
    2.0520562500000055,
    2.0520562500000024,
    2.0520562499999873,
    0.49901381675519885,
    0.1481198401266572,
    0.042138379587299275
   ]
  },
  "E": {
   "knots": [
    0.0,
    0.0,
    0.0,
    0.0,
    0.0,
    0.0,
    0.16564823676654641,
    0.16564823676654641,
    0.16564823676654641,
    0.2944857542516381,
    0.2944857542516381,
    0.2944857542516381,
    0.7509386733416771,
    1.0,
    1.0,
    1.0,
    1.0,
    1.0,
    1.0
   ],
   "coeffs": [
    -1.3237248619697297e-15,
    0.540000000000001,
    0.3365622074372975,
    1.8360249999999991,
    1.8360250000000036,
    1.8360249999999991,
    1.8360249999999991,
    1.836024999999992,
    1.8360249999999942,
    2.1379953138329775,
    0.6805794557372168,
    0.18798581065044767,
    0.047791104164423164
   ]
  },
  "zc": {
   "knots": [
    0.0,
    0.0,
    0.0,
    0.0,
    0.0,
    0.0,
    0.16564823676654641,
    0.16564823676654641,
    0.16564823676654641,
    0.2944857542516381,
    0.2944857542516381,
    0.2944857542516381,
    0.7509386733416771,
    1.0,
    1.0,
    1.0,
    1.0,
    1.0,
    1.0
   ],
   "coeffs": [
    -0.5232790224032581,
    -0.5632969848114393,
    0.052282440312819645,
    0.02999999999999851,
    0.030000000000000714,
    0.029999999999995433,
    0.029999999999994524,
    0.02999999999999817,
    0.02999999999999395,
    0.13967313272867188,
    -0.1760806395009864,
    0.6183857184955852,
    0.5898554596591604
   ]
  },
  "n": {
   "knots": [
    0.0,
    0.0,
    0.0,
    0.0,
    0.0,
    0.0,
    1.0,
    1.0,
    1.0,
    1.0,
    1.0,
    1.0
   ],
   "coeffs": [
    2.0,
    2.0,
    2.0,
    2.0,
    2.0,
    2.0
   ]
  },
  "k": {
   "knots": [
    0.0,
    0.0,
    0.0,
    0.0,
    0.0,
    0.0,
    1.0,
    1.0,
    1.0,
    1.0,
    1.0,
    1.0
   ],
   "coeffs": [
    0.0,
    0.0,
    0.0,
    0.0,
    0.0,
    0.0
   ]
  }
 },
 "front": {
  "kind": "point",
  "tip_radius_m": 0.3
 },
 "rear": {
  "kind": "base"
 },
 "cabin": {
  "x_start_m": 3.0,
  "x_end_m": 21.166
 },
 "fairness": {
  "inflections": {
   "crown": 1,
   "keel": 2,
   "plan": 2
  },
  "tv_ratio_max": 1.5
 },
 "fit": {
  "rms_m": 0.06486151575860317,
  "max_m": 0.27239270938791293,
  "lambda": 1.0,
  "tool_version": "loft_fit 0.1 + fairfit 1 (quality pass 2026-10-11)"
 },
 "provenance": [
  {
   "group": "A",
   "kind": "measured",
   "drawing": {
    "id": "atr_2020_atrfamily",
    "title": "ATR 72-600 factsheet 2020 (side/top renders)",
    "page": "factsheet",
    "sha256": "6be6cb95d98fa33199a5e6b35830c2a0b4c8ff8fa91a9f42c5cc3a6b37e4c1e5",
    "path": "<fit-workdir>/ATR72-600_factsheet2020.pdf"
   },
   "view": "top",
   "px_per_m": 49.77,
   "n_samples": 628,
   "rms_m": 0.051047216789113614,
   "max_m": 0.1003235058471148,
   "confidence": "C",
   "note": "plan half-width from the calibrated top silhouette (both halves averaged, centreline offset -0.030 m removed); wing/hstab/fairing intervals excluded (exclusions/ATR72-600.json); plateau value = preset D/2, line-width correction +0.000 m/side | quality pass 2026-10-11: refit under the Rust sampled fairness metric (inflections where radius < 50 local half-sizes) with the accuracy gates kept | INTEGRATION STEP A 2026-10-11: plateau forced to D = 2.865 m (secondary source: third-party ATR 72-600 familiarisation handout lists a maximum width of 2865 mm; consistent with the 2.57 m cabin width plus walls). The drawn plan measures 2.974 m (EWADE 2011 three-view; 2.999 m on the 2020 factsheet render), 0.054 m per side wider than the plateau, inside the class C gate. No primary external width exists in the EASA TCDS EASA.A.084 or the factsheets."
  },
  {
   "group": "E",
   "kind": "measured",
   "drawing": {
    "id": "atr_2020_atrfamily",
    "title": "ATR 72-600 factsheet 2020 (side/top renders)",
    "page": "factsheet",
    "sha256": "6be6cb95d98fa33199a5e6b35830c2a0b4c8ff8fa91a9f42c5cc3a6b37e4c1e5",
    "path": "<fit-workdir>/ATR72-600_factsheet2020.pdf"
   },
   "view": "side",
   "px_per_m": 36.14812633438857,
   "n_samples": 1185,
   "rms_m": 0.071733409396473,
   "max_m": 0.27239270938791293,
   "confidence": "C",
   "note": "half-height from crown and keel of the side silhouette; fin/engine/gear/fairing intervals excluded; plateau = preset height_m/2 (H measured 2.711 m) | quality pass 2026-10-11: refit under the Rust sampled fairness metric (inflections where radius < 50 local half-sizes) with the accuracy gates kept | INTEGRATION STEP A 2026-10-11: H = 2.71 m (factsheet 2020 side render; three-view side 2.70 m), crown datum cabin_z_m 0.03 + H/2 = 1.385 m unchanged."
  },
  {
   "group": "zc",
   "kind": "measured",
   "drawing": {
    "id": "atr_2020_atrfamily",
    "title": "ATR 72-600 factsheet 2020 (side/top renders)",
    "page": "factsheet",
    "sha256": "6be6cb95d98fa33199a5e6b35830c2a0b4c8ff8fa91a9f42c5cc3a6b37e4c1e5",
    "path": "<fit-workdir>/ATR72-600_factsheet2020.pdf"
   },
   "view": "side",
   "px_per_m": 36.14812633438857,
   "n_samples": 1185,
   "rms_m": 0.071733409396473,
   "max_m": 0.27239270938791293,
   "confidence": "C",
   "note": "centreline height; z datum: crown of the drawing = cabin_z + H/2 of the preset; nose tip z from the drawing -0.523 m (preset nose_z_m -0.52) | quality pass 2026-10-11: refit under the Rust sampled fairness metric (inflections where radius < 50 local half-sizes) with the accuracy gates kept"
  },
  {
   "group": "n",
   "kind": "template",
   "drawing": {
    "id": "atr_2020_atrfamily",
    "title": "ATR 72-600 factsheet 2020 (side/top renders)",
    "page": "factsheet",
    "sha256": "6be6cb95d98fa33199a5e6b35830c2a0b4c8ff8fa91a9f42c5cc3a6b37e4c1e5",
    "path": "<fit-workdir>/ATR72-600_factsheet2020.pdf"
   },
   "view": "front",
   "px_per_m": 36.14812633438857,
   "n_samples": 0,
   "rms_m": 0.0,
   "max_m": 0.0,
   "confidence": "C",
   "note": "n = 2 (ellipse): no dimensioned cabin cross-section is available in the masks; unmeasured"
  },
  {
   "group": "k",
   "kind": "template",
   "drawing": {
    "id": "atr_2020_atrfamily",
    "title": "ATR 72-600 factsheet 2020 (side/top renders)",
    "page": "factsheet",
    "sha256": "6be6cb95d98fa33199a5e6b35830c2a0b4c8ff8fa91a9f42c5cc3a6b37e4c1e5",
    "path": "<fit-workdir>/ATR72-600_factsheet2020.pdf"
   },
   "view": "side",
   "px_per_m": 36.14812633438857,
   "n_samples": 0,
   "rms_m": 0.0,
   "max_m": 0.0,
   "confidence": "C",
   "note": "k = 0 (shoulder at centreline): unmeasured"
  },
  {
   "group": "closure",
   "kind": "measured",
   "drawing": {
    "id": "atr_2020_atrfamily",
    "title": "ATR 72-600 factsheet 2020 (side/top renders)",
    "page": "factsheet",
    "sha256": "6be6cb95d98fa33199a5e6b35830c2a0b4c8ff8fa91a9f42c5cc3a6b37e4c1e5",
    "path": "<fit-workdir>/ATR72-600_factsheet2020.pdf"
   },
   "view": "side",
   "px_per_m": 36.14812633438857,
   "n_samples": 0,
   "rms_m": 0.0,
   "max_m": 0.0,
   "confidence": "C",
   "note": "front: point nose, tip radius 0.30 m (scan 0.10-0.30 m, minimum-knot/minimum-RMS choice, resolution-limited); rear: finite base A=0.012 m2 (a=0.109 m), E=0.066 m2 (e=0.258 m)"
  },
  {
   "group": "cabin",
   "kind": "dimension",
   "drawing": {
    "id": "atr_2020_atrfamily",
    "title": "ATR 72-600 factsheet 2020 (side/top renders)",
    "page": "factsheet",
    "sha256": "6be6cb95d98fa33199a5e6b35830c2a0b4c8ff8fa91a9f42c5cc3a6b37e4c1e5",
    "path": "<fit-workdir>/ATR72-600_factsheet2020.pdf"
   },
   "view": "side",
   "px_per_m": 36.14812633438857,
   "n_samples": 0,
   "rms_m": 0.0,
   "max_m": 0.0,
   "confidence": "C",
   "note": "cabin_start_x_m / tailcone_length_m of the preset (payload semantics, unchanged); the flat plateau of the loft is fitted from the drawing and is NOT the payload cabin interval"
  }
 ]
}